{
  "contract": "1.0",
  "kind": "run-spec",
  "name": "double-gauss-f5",
  "lens": {
    "kind": "fixture",
    "path": "contract/fixtures/v1/valid/optical-case/double-gauss.json"
  },
  "aperture": {
    "kind": "wide-open"
  },
  "lines": {
    "kind": "reference"
  },
  "fields": {
    "kind": "angles-deg",
    "values": [
      0,
      10,
      14
    ]
  },
  "imagePlane": {
    "kind": "design"
  },
  "frequenciesPerMm": [
    10,
    20,
    40
  ],
  "sampling": {
    "lvGridCap": 64,
    "bundleGrid": 33,
    "engines": {
      "optiland": {
        "numRays": 512
      }
    }
  },
  "rungs": [
    "r0",
    "r1",
    "r2",
    "r3",
    "r4"
  ],
  "engines": [
    "ref",
    "optiland"
  ],
  "referenceEngine": "ref"
}
